{
  "$schema": "https://anthropic.com/claude-code/marketplace.schema.json",
  "name": "f5-distributed-cloud",
  "version": "3.9.3",
  "description": "F5 Distributed Cloud automation plugins for network engineers and DevOps teams",
  "license": "MIT",
  "homepage": "https://github.com/robinmordasiewicz/f5xc-marketplace",
  "repository": "https://github.com/robinmordasiewicz/f5xc-marketplace",
  "owner": {
    "name": "Robin Mordasiewicz",
    "url": "https://github.com/robinmordasiewicz"
  },
  "metadata": {
    "description": "Curated F5 Distributed Cloud automation plugins with browser-based console automation, intelligent agents, and pre-built workflows",
    "pluginRoot": "./plugins",
    "categories": [
      "automation",
      "infrastructure",
      "security"
    ],
    "keywords": [
      "f5",
      "distributed-cloud",
      "waap",
      "load-balancer",
      "waf",
      "browser-automation"
    ]
  },
  "plugins": [
    {
      "name": "f5xc-console",
      "description": "Chrome browser automation for F5 XC console - navigate, crawl, and automate GUI operations",
      "version": "0.10.1",
      "author": {
        "name": "Robin Mordasiewicz",
        "url": "https://github.com/robinmordasiewicz"
      },
      "source": "./plugins/f5xc-console",
      "registry": {
        "type": "npm",
        "package": "@robinmordasiewicz/f5xc-console",
        "repository": "https://github.com/robinmordasiewicz/f5xc-console",
        "tarball": "https://registry.npmjs.org/@robinmordasiewicz/f5xc-console/-/f5xc-console-0.10.1.tgz"
      },
      "category": "automation",
      "tags": [
        "f5",
        "xc",
        "distributed-cloud",
        "browser",
        "console",
        "waap"
      ]
    }
  ]
}
